### ISSUE TITLE
peer_addr port different than what client was initiated with

### ISSUE THREAD

**Issue by oren0e** [thepacketgeek/rust-tcpstream-demo#1]
Hi,
First of all - great tutorials! I've been searching for such things for quite some time.
When I run the examples I get that the message of "Incoming from .." prints the same ip address as it should (the default one), but the port is different. My actions are quite simple:
```
./server
```
and in another terminal:
```
./client "this is my message"
```
Any ideas why the port is different than 4000 which is the default?
https://github.com/thepacketgeek/rust-tcpstream-demo/blob/861f5f467f681ddbafcbba75197895697ec329b8/lines/src/bin/server.rs#L20

**Comment by thepacketgeek** [comment]
Thanks @oren0e , I'm glad you're finding value in the examples :)

Given these logs:
```
Starting server on '127.0.0.1:4000'
Incoming from 127.0.0.1:49310
```

- The server is listening on port 4000
- The client will pick a random source port, which in this case is 49310. The destination port must be the server's listening port of 4000.

This can be confirmed by looking at the packets between the client and server. Note the source & destination ports on the first packet initiated by the client: 49310 > 4000

```
$ sudo tcpdump -nn -i lo tcp port 4000
listening on lo, link-type EN10MB (Ethernet), snapshot length 262144 bytes
18:55:22.903920 IP 127.0.0.1.49310 > 127.0.0.1.4000: Flags [S], seq 4225670934, win 65495, options [mss 65495,sackOK,TS val 2937639238 ecr 0,nop,wscale 7], length 0
18:55:22.903934 IP 127.0.0.1.4000 > 127.0.0.1.49310: Flags [S.], seq 756328501, ack 4225670935, win 65483, options [mss 65495,sackOK,TS val 2937639238 ecr 2937639238,nop,wscale 7], length 0
18:55:22.903943 IP 127.0.0.1.49310 > 127.0.0.1.4000: Flags [.], ack 1, win 512, options [nop,nop,TS val 2937639238 ecr 2937639238], length 0
18:55:22.903971 IP 127.0.0.1.49310 > 127.0.0.1.4000: Flags [P.], seq 1:8, ack 1, win 512, options [nop,nop,TS val 2937639238 ecr 2937639238], length 7
18:55:22.903976 IP 127.0.0.1.4000 > 127.0.0.1.49310: Flags [.], ack 8, win 512, options [nop,nop,TS val 2937639238 ecr 2937639238], length 0
18:55:22.903984 IP 127.0.0.1.49310 > 127.0.0.1.4000: Flags [P.], seq 8:9, ack 1, win 512, options [nop,nop,TS val 2937639238 ecr 2937639238], length 1
18:55:22.903987 IP 127.0.0.1.4000 > 127.0.0.1.49310: Flags [.], ack 9, win 512, options [nop,nop,TS val 2937639238 ecr 2937639238], length 0
18:55:22.904306 IP 127.0.0.1.4000 > 127.0.0.1.49310: Flags [P.], seq 1:8, ack 9, win 512, options [nop,nop,TS val 2937639239 ecr 2937639238], length 7
18:55:22.904314 IP 127.0.0.1.49310 > 127.0.0.1.4000: Flags [.], ack 8, win 512, options [nop,nop,TS val 2937639239 ecr 2937639239], length 0
18:55:22.904324 IP 127.0.0.1.4000 > 127.0.0.1.49310: Flags [P.], seq 8:9, ack 9, win 512, options [nop,nop,TS val 2937639239 ecr 2937639239], length 1
18:55:22.904328 IP 127.0.0.1.49310 > 127.0.0.1.4000: Flags [.], ack 9, win 512, options [nop,nop,TS val 2937639239 ecr 2937639239], length 0
18:55:22.904338 IP 127.0.0.1.4000 > 127.0.0.1.49310: Flags [F.], seq 9, ack 9, win 512, options [nop,nop,TS val 2937639239 ecr 2937639239], length 0
18:55:22.904370 IP 127.0.0.1.49310 > 127.0.0.1.4000: Flags [F.], seq 9, ack 10, win 512, options [nop,nop,TS val 2937639239 ecr 2937639239], length 0
18:55:22.904379 IP 127.0.0.1.4000 > 127.0.0.1.49310: Flags [.], ack 10, win 512, options [nop,nop,TS val 2937639239 ecr 2937639239], length 0
```

**Comment by oren0e** [comment]
My question is then: what is the source port? I thought that they need to operate on the same port

**Comment by thepacketgeek** [comment]
Each side has a single IP:port socket pair. The source port for the client is 49310, and the destination port is the known 4000 server port. When the server responds, the ports are reversed so the packet is received by the client on the correct port that it's listening on (49310).

Check out this guide for more info: http://www.steves-internet-guide.com/tcpip-ports-sockets/

**Comment by oren0e** [comment]
Thanks! The link is broken though...

**Comment by thepacketgeek** [comment]
Oh strange, here's another one that might also be useful: https://www.geeksforgeeks.org/difference-between-source-port-and-destination-port/
